pack_id,phase,name,description
10,1,Foundations Pack,Establishes engineering standards, environments, CI/CD, and baseline reliability.
20,1,AI & Data Pack,Defines AI routing logic, model management, and data governance foundations.
30,1,Product & Market Pack,Outlines product lifecycle and market alignment strategies.
40,1,Delivery & Operations Pack,Sets up deployment, release, and reliability operations frameworks.
50,1,Apps, Mobile & ASO Pack,Documents mobile app builds, ASO methodology, and app lifecycle.
60,1,Corporate Transparency Pack,Captures internal reporting, disclosures, and ethics alignment.
70,1,Labs & Trust Tools Pack,Explores experimental AI tools and ethical testbeds.
80,1,Community Outreach Pack,Structures developer relations and open-source community engagement.
90,1,Internal Ops & Knowledge Pack,Manages internal knowledgebases, wikis, and process automation.
95,1,Public Transparency Suite,Prepares sanitized data and docs for public/open-source release.
100,2,Automation & Orchestration Framework,Automates cross-service workflows and AI-assisted orchestration.
105,2,Security & Identity Control Framework,Defines RBAC/ABAC, authentication, and identity governance.
110,2,Ecosystem Integration API Framework,Standardizes internal/external API integrations and contracts.
115,2,Adaptive Growth & Maturity Framework,Enables stage-based system evolution and growth triggers.
120,2,Economic Value Modeling Framework,Connects cost, usage, and ROI metrics to decision automation.
125,2,Platform Intelligence & Learning Framework,Implements telemetry-driven platform learning loops.
130,2,Client Enablement & Education Pack,Documents training, onboarding, and customer education flows.
135,2,Ethical Scaling & Trust Stewardship Framework,Defines AI ethics, fairness, and bias mitigation systems.
140,2,Dynamic Systems Framework,Manages adaptive infrastructure and elasticity automation.
150,3,Narrative Reporting Framework,Transforms telemetry into persona-specific narrative briefings.
155,3,Context-Aware Briefing System,Generates reports tuned to context, urgency, and audience.
160,3,Actionable Intelligence Framework,Automates insights→decisions→actions with human oversight.
165,3,Human-Machine Partnership Protocol,Defines cooperation boundaries between AI and human control.
170,3,Business Storytelling Framework,Turns analytics into plain-language stories for executives.
175,3,Ethical Narrative & Trust Disclosure Framework,Documents transparency and explainability of AI narratives.
180,4,Finance Intelligence & Forecasting Framework,Implements forecasting, anomaly detection, and ERP readiness.
185,4,Accounting Automation & Integrity Pack,Automates reconciliation, classification, and SoD enforcement.
190,4,Reputation Management & Sentiment Suite,Analyzes brand sentiment and automates response playbooks.
195,4,HR & Workforce Intelligence Framework,Connects HRIS data with workforce analytics and engagement insights.
200,4,Audit & Assurance Automation Framework,Monitors compliance controls and generates audit evidence packs.
205,4,Product Design & Development Framework,Documents design→prototype→release cycles and feedback loops.
210,4,Product Research & Innovation Framework,Manages idea scoring, validation, and research pipelines.
220,5,Enterprise-in-a-Box Blueprint,Combines all packs into a unified digital enterprise model.
225,5,Enterprise Maturity Evolution Framework,Defines growth stages and governance thresholds for scale.
230,6,Ecosystem & Partner Enablement Pack,Expands platform SDKs, partner APIs, and marketplace strategy.
235,6,OpenForge Community Framework,Builds community governance, contribution flow, and open-source processes.
240,6,ClearForge Developer Toolkit,Defines SDKs, CLIs, and local development environments.
245,6,ClearForge Marketplace Framework,Documents plugin, template, and app distribution infrastructure.
250,6,Verification & Certification Framework,Creates Verified Partner and compliance certification systems.
260,7,Autonomous Orchestration Framework,Implements self-optimizing orchestration and auto-governance loops.
265,7,Learning & Evolution Framework,Builds continuous learning and model improvement loops.
270,7,Adaptive Compliance & Predictive Governance,Applies AI to predict compliance risks before they occur.
275,7,Enterprise Self-Optimization Protocol,Defines full autonomy thresholds and guardrails for adaptive enterprises.